{
  "azure": {
    "apim": {
      "capacity": 1,
      "publisher": {
        "email": "ai-platform@example.gov.uk",
        "name": "Defra AI Platform"
      },
      "sku": "Developer"
    },
    "application_insights": {
      "sampling_percentage": 100
    },
    "foundry": {
      "regions": ["uksouth", "swedencentral"]
    },
    "identities": {
      "portal_api_principal_object_id": "00000000-0000-0000-0000-000000000002"
    },
    "key_vault": {
      "soft_delete_retention_days": 7
    },
    "location": "uksouth",
    "log_analytics": {
      "daily_quota_gb": 1,
      "retention_in_days": 30,
      "subscription_activity_log": true
    },
    "named_exceptions": [],
    "network": {
      "mode": "public-minimal"
    }
  },
  "environment": "infradev",
  "naming": {
    "environment_instance": "1",
    "sub_type": "SND"
  },
  "service_code": "AIP"
}
